{
  "contract": "B.ReportTables",
  "schema_version": "1.0",
  "artifact_id": "report-tables-demo-001",
  "payload": {
    "tables": [
      {
        "table_idx": 0,
        "table_type": "VGHTC2024",
        "table_path": "tables/VGHTC2024_reports.csv"
      },
      {
        "table_idx": 1,
        "table_type": "CGMH2019",
        "table_path": "tables/CGMH2019_reports.csv"
      }
    ]
  }
}
